{
  "character": {
    "name": "Rafa",
    "age": 11,
    "trait": "economiza a mesada há três semanas pra comprar um pacote de figurinhas raras"
  },
  "scenes": [
    {
      "id": "s1",
      "text": "Sexta à noite, Rafa abre o álbum no quarto. A mãe trouxe um pacote surpresa — a avó mandou de presente. Ele rasga o papel prateado devagar, puxa as cinco cartas. Nada de brilhante. Só repetidas. Mas a mão já coça pra comprar outro."
    },
    {
      "id": "s2",
      "text": "Sábado de manhã, Rafa encara a banca de revistas. Uma pilha de pacotes azuis brilha no balcão. O dono diz: 'Esse lote novo dizem que vem com cromada rara.' Rafa conta as moedas no bolso — dá pra quatro pacotes. Só que ele tinha jurado economizar pro jogo de tabuleiro que custa o mesmo preço. Ele compra os quatro."
    },
    {
      "id": "s3",
      "text": "Em casa, abre um por um. No terceiro, a borda dourada aparece. Ele puxa a carta — um jogador que ele já tem. Mas a sensação de rasgar o papel e ver o dourado foi mais forte que a decepção. Ele abre o quarto pacote. Nada. Fica com a mão no bolso vazio, encarando as repetidas."
    }
  ],
  "ending": "Na semana seguinte, Rafa coloca o dinheiro do lanche num pote e risca num papel: '1 pacote por dia, só depois do dever.' No segundo dia, a borda dourada aparece de novo. Ele fecha o pacote devagar e guarda o pote. Decide poupar o resto pro jogo de tabuleiro.",
  "micro_check": {
    "question": "{{learner_name}}, por que Rafa comprou os quatro pacotes mesmo tendo guardado dinheiro pra outra coisa?",
    "options": [
      "Porque o pacote raro valia muito mais que o jogo",
      "Porque cada pacote podia ter a carta brilhante — e a chance de vir fazia ele esquecer o preço",
      "Porque o dono garantiu que o lote novo vinha com cromada",
      "Porque ele queria mostrar as cartas pros amigos na escola"
    ],
    "correct_index": 1,
    "rationale": "A incerteza do prêmio é mais viciante que o prêmio em si. Rafa não comprou pelo valor do jogo — comprou pela CHANCE de cada pacote, mesmo sabendo que a chance era pequena."
  }
}