{
  "character": {
    "name": "Lia",
    "age": 12,
    "trait": "passa o recreio falando do time da Copa, mas nunca deixa os outros terminarem uma fala sobre os times deles"
  },
  "scenes": [
    {
      "id": "s1",
      "text": "Quarta, 10h15. Recreio. Lia mal senta na mesa do pátio e já dispara: — Gente, meu time ganhou de virada ontem! O cara que entrou no segundo tempo fez dois e ainda deu uma assistência de letra que… Ela fala sem pausa enquanto tira o lanche da mochila, sem reparar que Pedro está com a mão erguida há três segundos."
    },
    {
      "id": "s2",
      "text": "Pedro abaixa a mão. Começa a falar mesmo assim: — Então, eu fui no estádio sábado e… — e Lia corta: — Ah, mas deixa eu contar o resto, é muito doido! O cara fez de cabeça e ainda deu um corte na zaga inteira… Pedro pega o celular, mexe distraído. A amiga ao lado, a Carol, que ia contar do gol que ela fez no recreio anterior, só morde o lanche em silêncio."
    },
    {
      "id": "s3",
      "text": "No sábado, o grupo se reúne pra ver o clássico na casa do Pedro. Todo mundo na sala. Lia chega animada, mas percebe que Pedro sentou longe, no outro sofá. Carol mal olha pra ela. O jogo começa e, no intervalo, quando Lia abre a boca pra contar do gol que viu, Pedro fala primeiro: — Gente, no estádio sábado, vi um lance que não passou na TV. Ninguém interrompe. Pedro fala até o fim. Lia fica quieta, segurando o copo de refrigerante."
    },
    {
      "id": "s4",
      "text": "Depois do jogo, Lia encontra Carol na cozinha. Carol fala baixinho: — É que você nunca deixa ninguém terminar. Aí a gente meio que desiste. Lia para. Engole seco. Na segunda, no recreio, Pedro começa: — Sobre o lance do estádio, foi assim… Lia morde a língua. Espera. Pedro termina. Então ela pergunta: — E o juiz não viu? Pedro sorri."
    }
  ],
  "ending": "Pedro pega um guardanapo amassado da mochila e desenha o lance na mesa. Lia escuta os próximos dez minutos sem cortar uma sílaba. O recreio acaba e ela nem tocou no sanduíche.",
  "micro_check": {
    "question": "{{learner_name}}, o que mudou no recreio de Lia na segunda-feira?",
    "options": [
      "Ela contou primeiro a história do time dela que tinha ganhado",
      "Ela deixou Pedro terminar de falar antes de responder",
      "Ela sentou com outra turma do pátio",
      "Ela pediu desculpas em voz alta pra todo mundo"
    ],
    "correct_index": 1,
    "rationale": "Lia não pediu desculpas nem mudou de assunto. Ela simplesmente parou de cortar. Deixou Pedro terminar. Aí perguntou algo sobre o que ele disse — o que mostra que ela ouviu de verdade."
  }
}
