{
  "character": {
    "name": "Sara",
    "age": 10,
    "trait": "queria virar paleontóloga, comprava livros grossos de dinossauro e travava na introdução de cada um"
  },
  "scenes": [
    {
      "id": "s1",
      "text": "Sara tinha quatro livros grossos sobre dinossauros na estante. Cada um com mais de 300 páginas. Toda vez que sentava pra ler, planejava uma hora de leitura, lia oito páginas e fechava o livro com dor de cabeça. Em seis meses, nenhum livro tinha passado do capítulo 1. As fichas dos dinossauros que ela queria estudar continuavam em branco."
    },
    {
      "id": "s2",
      "text": "A bibliotecária da escola, que tinha um doutorado em biologia, dá uma dica: 'Esquece a hora de leitura. Hoje, depois do jantar, você lê UM PARÁGRAFO sobre o velociraptor. Só um. Pode fechar o livro.' Sara acha estranho. Mas faz. Dia 1: um parágrafo. Dia 2: um parágrafo — mas continua e lê a página inteira. Dia 12: vinte minutos de leitura, sem ter prometido."
    },
    {
      "id": "s3",
      "text": "Quatro meses depois, Sara tem três fichas completas: velociraptor, triceratops, e um sobre o iguanodonte que nem estava na lista original. A regra dela virou: ler um parágrafo, escrever uma linha. Tão pequena que cabia até no dia da gripe. A menina que escreve sobre dinossauro virou identidade — não meta. A bibliotecária pede pra Sara apresentar pra turma do primário."
    }
  ],
  "ending": "Sara terminou o primeiro livro inteiro em sete meses, lendo em micro-sessões quase todo dia. Não em maratonas — em mordidas. As fichas viraram um caderno, o caderno virou apresentação. Pra mãe, a piada: 'Sara virou paleontóloga estudante um parágrafo por vez.'",
  "micro_check": {
    "question": "Qual a regra que fez Sara terminar o primeiro livro?",
    "options": [
      "Ler um parágrafo por dia, pequeno o bastante pra caber até em dia ruim.",
      "Reservar uma hora cheia depois do jantar pra ler sem interrupção.",
      "Pedir pra bibliotecária cobrar todo dia até virar rotina.",
      "Esperar virar adulta pra finalmente ter foco pra ler livro grosso."
    ],
    "correct_index": 0,
    "rationale": "Sara pivota o problema do 'tamanho do livro' pra 'cabência do parágrafo do dia'. Um parágrafo entra em qualquer dia, e a regularidade vai virando ficha, caderno, apresentação — sem precisar das maratonas do sábado."
  }
}
