{
  "character": {
    "name": "Rafa",
    "age": 11,
    "trait": "economiza a mesada há três semanas pra comprar o livro grande de paleontologia que viu na livraria"
  },
  "scenes": [
    {
      "id": "s1",
      "text": "Sexta à noite, Rafa abre a coleção de mini-figuras de dinossauro no quarto. A tia mandou um saquinho surpresa de presente — daqueles cegos, sem mostrar o que vem dentro. Ele rasga o plástico devagar, puxa a peça. Um diplodoco. Já tem três iguais. Mas a mão já coça pra comprar mais um saquinho."
    },
    {
      "id": "s2",
      "text": "Sábado de manhã, Rafa encara a banca da papelaria do shopping. Uma pilha de saquinhos cegos da nova linha brilha no balcão. A vendedora diz: 'Essa série nova dizem que vem com um T-Rex cromado raro.' Rafa conta as moedas no bolso — dá pra quatro saquinhos. Só que ele tinha jurado economizar pro livro. Compra os quatro."
    },
    {
      "id": "s3",
      "text": "Em casa, abre um por um. No terceiro, o ícone metálico aparece — mas é um pterodáctilo cromado, não o T-Rex. A sensação de rasgar o plástico e ver o brilho foi mais forte que a decepção. Abre o quarto. Outro diplodoco. Fica com a mão no bolso vazio, encarando duplicatas e o livro que continua na vitrine."
    }
  ],
  "ending": "Na semana seguinte, Rafa cria uma regra: '1 saquinho por semana, só depois de terminar a ficha do dinossauro da vez.' No segundo sábado, o T-Rex cromado aparece. Ele fecha o saquinho devagar e guarda o restante do dinheiro pro livro. Aprende a desligar a vontade quando a mão coça por mais uma surpresa.",
  "micro_check": {
    "question": "{{learner_name}}, por que Rafa comprou os quatro saquinhos mesmo tendo guardado pro livro?",
    "options": [
      "Porque o T-Rex cromado valia muito mais que o livro de paleontologia",
      "Porque cada saquinho podia ter a peça rara — e a chance fez ele esquecer o objetivo",
      "Porque a vendedora garantiu que a série nova vinha com cromado",
      "Porque ele queria mostrar as peças pros amigos da escola"
    ],
    "correct_index": 1,
    "rationale": "A incerteza da peça é mais viciante que a peça em si. Rafa não comprou pelo valor do livro — comprou pela CHANCE de cada saquinho cego, mesmo sabendo que a chance era pequena."
  }
}
