{
  "ending": "No recreio da semana seguinte, alguém grita de novo 'corre que o Cauã vai passar'. Arthur olha pra trás. O menino da mochila azul tá sentado no banco, almoçando. O grupo espera. Arthur não corre. Ele só senta do lado e pergunta: 'Que episódio você tá?'",
  "scenes": [
    {
      "id": "s1",
      "text": "Quarta-feira, 10h37. Recreio. Arthur senta no banco e puxa o lanche. Dois meninos passam correndo, um esbarra no cotovelo dele. O pão cai. 'Foi mal', grita o garoto sem parar. Arthur abaixa, pega o pão, limpa na calça. Do lado, o menino da mochila azul — o Cauã — ri baixinho. 'Toda semana eles esbarram em alguém e pedem desculpa correndo.' Arthur ri também, mas o riso morre quando vê Cauã olhando pro chão."
    },
    {
      "id": "s2",
      "text": "No dia seguinte, o mesmo recreio. Arthur senta do lado de Cauã de novo. Cauã não tira o olho do chão. 'Você sempre come sozinho?' Arthur pergunta. Cauã encolhe os ombros. 'Os meninos lá correm, mas se eu sentar com eles, eles param. E aí não sei.' Ele morde o lanche. Arthur olha pros dois lados. O grupo correndo, as risadas. Ele sente uma coisa no estômago — não é fome."
    },
    {
      "id": "s3",
      "text": "Sexta-feira. Arthur chega no banco e Cauã não tá. Tá no outro lado do pátio, perto da quadra, perto do grupo. Três meninos em volta dele. Um deles — o que esbarrou no Arthur — fala alguma coisa. Cauã ri sem graça. O menino pega a mochila de Cauã e joga pro outro. Cauã corre atrás. O grupo ri. Arthur vê o menino da mochila azul parar no meio do pátio, mochila na mão, olhando em volta. Ninguém senta perto."
    },
    {
      "id": "s4",
      "text": "Arthur levanta. Anda. As pernas vão, ele não pensa muito. Chega no meio do pátio. Pára do lado de Cauã. 'Vem, esqueci o lanche, divide o teu.' Cauã ergue a cabeça. O grupo olha. O menino que jogou a mochila abre a boca, mas não sai som. Arthur puxa Cauã pelo ombro e os dois atravessam o pátio de volta pro banco. O coração de Arthur bate forte. Mas ele não olha pra trás."
    }
  ],
  "character": {
    "age": 11,
    "name": "Arthur",
    "trait": "senta no mesmo banco todo recreio, nunca se meteu em briga nem chamou atenção"
  },
  "micro_check": {
    "question": "{{learner_name}}, o que fez Arthur levantar e andar até o meio do pátio?",
    "options": [
      "Ele queria provar que era mais forte que o grupo",
      "Ele viu Cauã sozinho e lembrou que também não gosta de ficar isolado",
      "Ele estava com fome e queria o lanche de Cauã",
      "O professor mandou ele buscar a mochila"
    ],
    "correct_index": 1,
    "rationale": "Arthur não age por raiva nem por cálculo. Ele age porque vê no outro algo que reconhece — e o corpo vai antes da cabeça decidir se é seguro. A coragem não aparece como grito, aparece como passo."
  }
}