{
  "character": {
    "name": "Rafa",
    "age": 12,
    "trait": "decidiu que vai ser goleiro do time da escola e treina toda semana"
  },
  "scenes": [
    {
      "id": "s1",
      "text": "Sábado, jogo contra a escola rival. A bola vem rasteira, meio torta, no meio de uma confusão na área. Rafa não pensa — cai pro lado esquerdo, espalma. A bola sobra pro atacante adversário, que chuta por cima. 'SORTE, GOLEIRO!' gritam os amigos. Rafa levanta, sem saber direito o que fez."
    },
    {
      "id": "s2",
      "text": "No intervalo, o técnico chega: 'Rafa, naquele lance, você pulou antes de ver onde a bola ia. Por quê?' Rafa: 'Eu… vi o movimento do corpo dele, acho.' O técnico: 'Seu corpo sabe mais que sua cabeça. Você treinou isso. Mas no próximo, tenta segurar um segundo antes de pular.' Rafa franze a testa."
    },
    {
      "id": "s3",
      "text": "Segundo tempo, falta perto da área. Bola na barreira, sobra solta na entrada da área. Um atacante rival vem batendo. Rafa pensa: 'Ele vai chutar no canto esquerdo, igual no treino.' Ele hesita, calcula, espera um milissegundo a mais. O chute sai seco, no ângulo direito. Gol. Rafa fica parado, olhando a bola dentro do gol."
    }
  ],
  "ending": "Rafa tira a luva, aperta o punho. Não sabe explicar por que a mão que salvou no primeiro tempo parou no segundo.",
  "micro_check": {
    "question": "{{learner_name}}, por que Rafa levou o gol no segundo tempo?",
    "options": [
      "O atacante chutou muito forte e no ângulo",
      "Rafa pensou demais e demorou a reagir",
      "A barreira não pulou na hora certa",
      "O técnico pediu pra ele segurar o pulo"
    ],
    "correct_index": 1,
    "rationale": "No primeiro lance, Rafa agiu no automático, sem pensar — e salvou. No segundo, ele tentou calcular, usar a lógica, e perdeu o timing. O corpo sabe mais rápido que a cabeça quando a cabeça tenta assumir o controle."
  }
}