{
  "character": {
    "name": "Isa",
    "age": 12,
    "trait": "adora inventar desafios impossíveis pra turma do 7º ano no recreio"
  },
  "scenes": [
    {
      "id": "s1",
      "text": "Segunda-feira, 10h37. Isa encara o pote de vidro no refeitório — cento e quarenta e duas balas de goma, ela contou. 'Adivinha a cor da que eu tirar. Se errar, paga um salgado.' A fila do almoço inteira para. Alguém grita: 'Vermelha!' Outro: 'Azul!' A merendeira Dona Célia segura o pote e ri."
    },
    {
      "id": "s2",
      "text": "Isa enfia a mão, mexe, tira uma amarela. Perdeu o salgado? Não — ela apostou em 'qualquer cor que não seja verde', porque viu que só tinha três verdes no fundo. O pote não é mágico. Ele só tem um padrão que ninguém parou pra contar."
    },
    {
      "id": "s3",
      "text": "Na quarta, o pote volta. Dessa vez Isa não aposta. Ela pede um guardanapo, despeja as balas na mesa, separa por cor, conta, anota num papel. Trinta e oito vermelhas, quarenta e uma laranjas, vinte e duas amarelas, dezenove rosas, três verdes. Recolhe tudo. Olha pra fila."
    },
    {
      "id": "s4",
      "text": "Ela fecha os olhos, enfia a mão, tira. Abre. Amarela. 'Adivinha a cor', ela diz. O menino na frente chuta: 'Vermelha?' Isa abre a mão. 'Errou. Paga um salgado.' A fila aplaude. Ela não contou pra ninguém que tinha acabado de separar as amarelas pro lado de cima do pote."
    }
  ],
  "ending": "Na sexta, o pote some do refeitório. Dona Célia diz que 'alguém' levou pra casa. Isa não diz nada. No caderno de matemática, na última folha, tem um desenho: um círculo cortado em fatias coloridas, com números ao lado de cada fatia.",
  "micro_check": {
    "question": "{{learner_name}}, o que Isa FEZ de diferente na quarta-feira que mudou o resultado do jogo?",
    "options": [
      "Ela contou quantas balas de cada cor tinha no pote",
      "Ela pediu pra Dona Célia escolher a bala no lugar dela",
      "Ela chutou a cor que ninguém tinha chutado ainda",
      "Ela colocou mais balas verdes no pote de propósito"
    ],
    "correct_index": 0,
    "rationale": "Isa parou de chutar e usou a CONTAGEM pra saber que as amarelas eram muitas e as verdes, poucas. Com os números na mão, ela podia prever melhor — e até esconder que tinha arrumado as balas no pote."
  }
}