{
  "character": {
    "name": "Bia",
    "age": 12,
    "trait": "guarda o troco errado do mercado e jura que o caixa que errou"
  },
  "scenes": [
    {
      "id": "s1",
      "text": "Sexta, 18h. Bia paga um salgadinho e um suco com R$20. O caixa devolve R$17. Ela pega o dinheiro, sai. No portão do mercado, conta: R$5, R$10, R$12... 'Ué, ele me deu R$17? O troco era R$15.' Ela olha pra trás. A fila tem sete pessoas. O caixa é novo, parece perdido. Bia guarda o dinheiro e vai embora."
    },
    {
      "id": "s2",
      "text": "Noite em casa. Bia abre o cofrinho pra guardar os R$2. Pára. Fecha o cofrinho e deixa o dinheiro em cima da mesa. A mãe pergunta: 'Não vai guardar?' Bia: 'Depois.' A mãe não insiste. Bia passa a noite inteira com os R$2 na mesa, do lado do controle remoto."
    },
    {
      "id": "s3",
      "text": "Sábado de manhã. Bia volta no mercado. O caixa novo não tá lá. Outro funcionário atende. Bia: 'Ontem o caixa me deu troco errado. A mais. Quero devolver.' O funcionário chama o gerente. O gerente confere o caixa, bate o olho no livro de ocorrências: 'O menino novo foi descontado no fim do dia. Faltaram R$2 no caixa dele.'"
    }
  ],
  "ending": "O gerente agradece, devolve os R$2 pro caixa, e Bia sai do mercado com um Chicabom que não pediu. Ela não conta pra ninguém. Mas no ônibus de volta, ela passa a mão no bolso e sente o som do papel. Não era o dinheiro. Era o silêncio.",
  "micro_check": {
    "question": "{{learner_name}}, por que Bia NÃO guardou os R$2 no cofrinho naquela noite?",
    "options": [
      "Ela queria gastar o dinheiro em outra coisa no dia seguinte",
      "Ela sabia que o dinheiro não era dela e aquilo pesava na mão",
      "Ela esqueceu de guardar porque tava distraída com o controle",
      "Ela ficou com medo da mãe descobrir e brigar"
    ],
    "correct_index": 1,
    "rationale": "O dinheiro extra não era dela — e ela sentiu isso antes de qualquer conversa. O corpo sabe antes da cabeça admitir. Guardar no cofrinho seria fingir que o erro não existia."
  }
}