{
  "character": {
    "name": "Téo",
    "age": 10,
    "trait": "filho do meio numa casa cheia, decidiu que 'incomodar é feio' e que resolver sozinho é mais maduro"
  },
  "scenes": [
    {
      "id": "s1",
      "text": "Téo trava na matemática há três semanas. Frações. Não entende. Na sala, finge que entendeu pra professora não perceber. Em casa, abre o caderno na mesa da cozinha, olha 20 minutos, fecha. A mãe passa correndo carregando o irmão de colo. Téo pensa: 'ela tá ocupada, depois eu vejo.'"
    },
    {
      "id": "s2",
      "text": "Prova na segunda. Domingo de noite, Téo não dorme, com dor de barriga. A prima Manu, 16 anos, dormindo lá em casa, escuta ele revirando. Vai no quarto: 'Que foi?' Téo solta tudo de uma vez, voz embargada: 'Não entendo fração e a prova é amanhã e eu não consigo perguntar pra ninguém.'"
    },
    {
      "id": "s3",
      "text": "Manu acende a luz, pega o caderno. 'Pega uma pizza imaginária. Corta em 4.' Em 40 minutos, com pedaços de pão e uma faca de manteiga, Téo entende meio, um terço, dois quintos. Manu termina: 'Por que você não chamou ninguém antes?' Téo: 'Achei que ia atrapalhar.' Manu: 'Atrapalha muito mais a gente descobrir três semanas depois.'"
    }
  ],
  "ending": "Téo tira 6 na prova. Não 10. Mas ele saiu da prova respirando, não com dor de barriga. E aprendeu o pior do orgulho disfarçado de educação: ele tinha guardado um problema pequeno até virar pânico — sozinho, no escuro.",
  "micro_check": {
    "question": "{{learner_name}}, por que o Téo demorou tanto pra pedir ajuda?",
    "options": [
      "Porque achou que ia 'atrapalhar' e que pedir era incomodar.",
      "Porque a professora tinha proibido perguntar em casa.",
      "Porque os pais dele tinham brigado naquela semana.",
      "Porque ele queria provar pra Manu que era mais inteligente."
    ],
    "correct_index": 0,
    "rationale": "Téo confundiu humildade com sumiço. 'Não incomodar' virou desculpa pra ficar sozinho com algo grande demais. Pedir ajuda cedo é força — quase sempre o outro se sente valorizado por ser chamado, não atrapalhado."
  }
}
