{
  "character": {
    "name": "Léo",
    "age": 11,
    "trait": "ganha dinheiro extra ajudando a avó com pequenas tarefas e gasta tudo no primeiro lugar brilhante que vê"
  },
  "scenes": [
    {
      "id": "s1",
      "text": "Quarta, 16h. A avó paga R$50 pra Léo digitar a lista de compras do mês. Léo já estava de olho num boné dos Lakers da loja do shopping da esquina. Sai da casa da avó direto pra lá. R$48,90 depois, volta com o boné na cabeça antes mesmo de pôr no pé da escada de casa."
    },
    {
      "id": "s2",
      "text": "Sexta. A turma combina o cinema de tarde — filme novo do Homem-Aranha. Entrada R$25 + pipoca R$15 = R$40. Léo conta o que sobrou: R$1,10. Pede pra mãe: 'Empresta R$40?' Mãe: 'Não. Você acabou de ganhar R$50 da vovó na quarta.' Léo: 'Mas era pra uma coisa importante.' Mãe: 'O boné? Léo. O cinema também — e você combinou de ir desde semana passada.'"
    },
    {
      "id": "s3",
      "text": "Léo fica em casa. A turma manda story da pipoca, foto na poltrona, vídeo do trailer da Marvel antes do filme. Léo passa o sábado com o boné em cima da escrivaninha. No domingo de manhã, joga ele dentro da gaveta de meias e fecha com força."
    },
    {
      "id": "s4",
      "text": "Quarta seguinte, Léo digita a lista da avó de novo. Recebe R$50. Coloca a nota dobrada no bolso de trás. No caminho pra casa, passa em frente à mesma loja do shopping. Olha a vitrine. Continua andando. Em casa, separa R$25 num envelope que escreve 'cinema sexta' e guarda na gaveta — em cima do boné."
    }
  ],
  "ending": "Sexta, cinema. Léo entra primeiro, com o ingresso já pago. A pipoca, ele divide com a turma. O boné dos Lakers continua na gaveta, embaixo do envelope. Léo nem se lembra dele até desfazer a mala da escola, semanas depois.",
  "micro_check": {
    "question": "{{learner_name}}, qual o pulo na cabeça do Léo na hora que ele viu o boné na vitrine?",
    "options": [
      "Léo pesou com calma boné contra cinema antes de decidir gastar",
      "O cérebro entregou recompensa pelo brilho de AGORA — o cinema da sexta nem entrou na conta",
      "Léo não gostava de cinema mesmo, foi só sincero consigo",
      "A avó tinha mandado ele comprar o boné, ele só obedeceu"
    ],
    "correct_index": 1,
    "rationale": "Recompensa imediata dispara forte quando algo brilhante aparece — o cérebro nem pesa o que está marcado pra depois. Léo escolheu pouco-agora (boné) e nem viu que jogou fora muito-depois (cinema com a turma)."
  }
}
