{
  "character": {
    "name": "Tainá",
    "age": 12,
    "trait": "torceu o pulso na trilha do clube de paleontologia e agora só pode acompanhar a oficina sem tocar nas peças"
  },
  "scenes": [
    {
      "id": "s1",
      "text": "Terça, 17h30, sala do clube. Tainá senta na cadeira com o pulso enfaixado e assiste a monitora explicar como diferenciar uma vértebra cervical de uma caudal num esqueleto de saurópode. Ela anota tudo no caderno — formato do centro, posição do canal neural, ângulo das costelas. 'Já peguei', ela fala. Em casa, revê o esquema. Sente que entendeu."
    },
    {
      "id": "s2",
      "text": "Na quinta-feira, a monitora chama: 'Tainá, explica isso pros novatos do clube. Vou pegar o microscópio na outra sala.' Ela congela. Abre a boca e sai: 'Então… cervical é da frente… caudal é da cauda…' Os novatos olham as réplicas. Um pergunta: 'Mas e se o canal neural for grande? É cervical ou caudal?' Tainá descobre que saber de cor não é saber explicar."
    },
    {
      "id": "s3",
      "text": "Sábado, ela pede pra montar uma réplica articulada com os novatos. Pega cada peça com a mão boa, narra devagar. 'Esta tem o canal grande e o centro curto — cervical. Olha o ângulo da costela.' Um novato pega a peça seguinte e erra a posição. Tainá corrige. O novato acerta a próxima sozinho. Tainá ri: 'Agora eu entendi de verdade.'"
    }
  ],
  "ending": "Na segunda, a monitora pergunta quem vai explicar a anatomia do pescoço pro grupo da visita. Tainá levanta a mão antes de pensar. Dessa vez, abriu o caderno só pra mostrar os desenhos.",
  "micro_check": {
    "question": "{{learner_name}}, o que fez Tainá realmente entender a anatomia das vértebras?",
    "options": [
      "Assistir a monitora explicar e anotar no caderno",
      "Ensinar os novatos e ver eles montando a réplica passo a passo",
      "Rever o esquema desenhado em casa várias vezes",
      "Pedir ajuda pra monitora na outra sala"
    ],
    "correct_index": 1,
    "rationale": "Tainá só entendeu de verdade quando precisou ENSINAR — porque ensinar obriga o cérebro a reorganizar o conhecimento, encontrar lacunas e preenchê-las. Assistir e anotar é consumir; ensinar é criar."
  }
}
