{
  "character": {
    "name": "Mariana",
    "age": 15,
    "trait": "vivia com a mãe e a avó desde que o pai sumiu — guardava raiva do pai como quem guarda um casaco grosso"
  },
  "scenes": [
    {
      "id": "s1",
      "text": "O pai da Mariana mandou mensagem depois de quatro anos sumido. 'Filha, posso te ver?' Mariana leu três vezes. Apagou. Voltou. Apagou de novo. Pelo resto do dia, ficou com um peso no peito que parecia engolido. À noite, gritou com o irmão menor por nada. Bateu a porta. Chorou no chuveiro."
    },
    {
      "id": "s2",
      "text": "A avó, dona Cida, bate na porta do quarto. Senta na beirada da cama. 'Eu sei que ele te machucou. E eu sei que você tá com raiva dele há quatro anos. Mas, querida, quem tá pagando essa raiva é você. Ele tá tranquilo na vida dele. Você que não dorme.'"
    },
    {
      "id": "s3",
      "text": "Mariana: 'Vó, se eu perdoar, é como se ele tivesse razão.' Dona Cida pega a mão dela. 'Perdoar não é dar razão. É soltar. É você dizer pra você mesma: chega, eu não quero mais carregar isso. Não precisa nem responder pra ele. Pode soltar dentro de você primeiro.' Mariana fica em silêncio. Lá fora, o cachorro late."
    }
  ],
  "ending": "Mariana não respondeu o pai naquela semana. Nem na seguinte. Mas começou a dormir melhor depois de uma noite em que, no escuro, sussurrou pra si mesma: 'eu não vou mais carregar isso por ele.' Um mês depois, respondeu — uma frase curta, sem raiva.",
  "micro_check": {
    "question": "{{learner_name}}, o que a avó da Mariana explicou sobre perdoar?",
    "options": [
      "Que perdoar significa esquecer o que aconteceu.",
      "Que perdoar é dar razão pra quem te machucou.",
      "Que perdoar é soltar — quem paga a raiva guardada é quem guarda.",
      "Que ela tinha obrigação de receber o pai de volta."
    ],
    "correct_index": 2,
    "rationale": "A avó separa perdão de absolvição. Perdoar é soltar o peso de dentro — não dizer que o que o outro fez foi certo. Guardar mágoa é beber veneno esperando o outro morrer; quem fica intoxicado é quem segura o copo."
  }
}
